artist,song,year,verso_texto,val_AR,val_MO,val_DI,val_PO,val_NA,val_GO,ia_AR,ia_MO,ia_DI,ia_PO,ia_NA
Los Tucanes De Tijuana,El Jefazo,1998,Mire señor comandante,0,0,0,1,0,0,0,0,0,0,0
Alemán,Del 98,2019,"El patrón, el rey, el jefe en esto del rap",0,0,0,0,0,0,0,0,0,0,0
Los Tucanes De Tijuana,Suerte Marcada,2008,El comandante y su gente,0,0,0,2,0,0,0,0,0,0,0
Los Tucanes De Tijuana,Gente Del Cartel,2014,Yo soy gente del cártel,0,0,0,3,0,0,0,0,0,0,0
Voz De Mando,Estrategias de Guerra,2013,Traía al mando mucha gente,0,0,0,3,0,0,0,0,0,0,0
Los Tigres Del Norte,Contrabando Y Robo,1988,Era el jefe de la banda,0,0,0,2,0,0,0,0,0,0,0
"""El Piporro""",Llego Borracho El Borracho,2002,"Del jefe del orden publico, y primo del que cerraba",0,0,0,2,0,0,0,0,0,0,0
Los Tucanes De Tijuana,El Catador,1998,Y en clave le dijo al jefe,0,0,0,2,0,0,0,0,0,0,0
Remmy Valenzuela,El Rescate,2014,uno aquí sigo firme a la orden del señor por un poco de,0,0,0,3,0,0,0,0,0,0,0
Remmy Valenzuela,24 Horas,2014,el jefe me dio la orden,0,0,0,2,0,0,0,0,0,0,0
"""El Piporro""",El Güero Aventado,2002,"De los hombres más entrones del barrio de los matones, es el güero",1,0,0,0,0,0,0,0,0,0,0
Vaquero's Musical,El Mujeron,1997,Ay en mi barrio murió un señor del corazón.,0,0,0,0,0,0,0,0,0,0,0
Calibre 50,Escuela Del Virus Antrax,2012,"Patrocino su carrera, sus gastos de escuela, el señor comandante",0,0,0,1,0,0,0,0,0,0,0
Grupo Laberinto,Clave 7,1996,Oiga señor comandante,0,0,0,1,0,0,0,0,0,0,0
Los Invasores De Nuevo Leon,Clave 7,2024,"Adiós, señor comandante",0,0,0,0,0,0,0,0,0,0,0
Los Tucanes De Tijuana,El Chapo Guzmán,1996,Menos jefe de una banda,0,0,0,2,0,0,0,0,0,0,0
Los Tucanes De Tijuana,El Gallo,1997,Gente de clave privadaaa...,0,0,0,2,0,0,0,0,0,0,0
Chino Pacas,GTO,2025,"Aquí traigo balas, también a mi banda, puro locote que el barrio levanta",1,0,0,1,0,0,0,0,0,0,0
Larry Hernández,El Taliban,2009,Mientras train orden y mando,0,0,0,2,0,0,0,0,0,0,0
Peso Pluma,Rubicon,2023,Nos mantenemos a la orden del Señor,0,0,0,2,0,0,0,0,0,0,0
El Komander,La Vuelta Cargada,2013,Tal vez sea la gente que cuida la plaza,1,0,0,2,0,0,0,0,0,0,0
Valentín Elizalde,Clave Privada,2013,"ahora me llaman patrón, tengo mi clave privada.",0,0,0,2,0,0,0,0,0,0,0
Los Huracanes Del Norte,Clave 7,1988,"Adiós señor comandante, aquí lo llevo en mi lista",0,0,0,2,0,0,0,0,0,0,0
Calibre 50,El Niño VZ,2012,La plaza tengo a mi mando,0,0,0,2,0,0,0,0,0,0,0
Natanael Cano,Traigo Ganas,2022,El jefe dice que la plaza no se cuida sola,1,0,0,2,0,0,0,0,0,0,0
"Peso Pluma, Luis R Conriquez",Siempre Pendientes,2022,Cuido la plaza del señor Guzmán,1,0,0,2,0,0,0,0,0,0,0
Carlos Y Jose,Jacinto El Tullido,1984,yo soy de los meros hombres entienda teniente,0,0,0,2,0,0,0,0,0,0,0
Los Tigres Del Norte,Leopoldo Rios,2007,"La gente se amontonaba, viendo al teniente en el piso",2,0,0,1,0,0,0,0,0,0,0
Gerardo Ortiz,A La Orden Del Flaco,2021,Y aquí la plaza ya tiene patrón,0,0,0,3,0,0,0,0,0,0,0
El Komander,Una Pantera En Las Cachas,2013,La gente sigue y a mi mando,0,0,0,3,0,0,0,0,0,0,0
Voz De Mando,De Corazón Ranchero,2015,Mi bendición para todos mando un fuerte abrazo a mi compadre Chapo,0,0,0,1,0,0,0,0,0,0,0
Faruz Feet,Underdogg,2015,convierte en tu patrón mi nombre señor acción budha Vhu Para el,0,0,0,0,0,0,0,0,0,0,0
Millonario,Casco Nazi,2015,"""Córrele pa'l chante, avísale a mi jefe pa' que le hable al comandante""",0,0,0,2,0,0,0,0,0,0,0
Cartel De Santa,Si Son Bien Jotos ,2006,Cuatro metros bajo tierra tapan el olor a muerto,3,0,0,0,0,0,0,0,0,0,0
Los Huracanes Del Norte,El Mocho Chavez,2006,"El mocho Chavez cayo, con diez tiros de pistola",3,0,0,0,0,0,0,0,0,0,0
Grupo Exterminador,Las Panteras,1996,porq se visten de negro les apodan las panteras y les queda el nombresito en verdad son unas fieras no le temen al gobierno y se matan con cualquiera las panters tienen garras y muy filosos colmillos y como estas son humanas traen puro cuerno de chibo los las han enfrentado ninguno ha quedado vivo dicen q una es sinaluence de durango y michuakan tierra de contrabandistas ya se lo imaginaran tres panteras eyerbadas q bonito rujiraaan con un viper en la bolsa celular y unas troconas con pistola en la situra pues se ben retematonas cargan puras ran del ano y se miran muy perronas cuando les ponen retenes por toas las carreteras porq son muy peligrosas poreso la ley copera porq se mochan bonito con lo jefes las panteras son las reinas de la droga yerba goma y heroina tienen muy buenos contactos con la mafia de lachina mientras haiga compradores el trafiq no ternina,3,2,0,0,0,0,0,0,0,0,0
Antonio Aguilar,Valente Quintero,1988,Se oyen tiros de pistola,2,0,0,0,0,0,0,0,0,0,0
Antonio Aguilar,Corrido De Arnulfo Gonzalez,1997,"Con la pistola en la mano, con la muerte lo amago",3,0,0,0,0,0,0,0,0,0,0
Los Huracanes Del Norte,Sangre De Gallo,2000,Me gusta tirar balazos,2,0,0,0,0,0,0,0,0,0,0
Chalino Sánchez,Los Hermanos Mata,2008,Se oyeron cuatro balazos,2,0,0,0,0,0,0,0,0,0,0
Antonio Aguilar,La Güera Chabela,1988,Cuatro balazos le dio,3,0,0,0,0,0,0,0,0,0,0
Carlos Y Jose,Jacinto El Tullido,1984,suenan balazos a muerte,3,0,0,0,0,0,0,0,0,0,0
Elote El Barbaro,Esto Es México ,2015,"gringos, armas, tiros, muertos,",3,0,0,0,0,0,0,0,0,0,0
Chalino Sánchez,Hermanos Garcia,2012,Cuatro armas originales,1,0,0,0,0,0,0,0,0,0,0
Peso Pluma,El Chuletas,2021,Yo ya porte charola de gobierno fusil largo y arma corta,2,0,0,0,0,0,0,0,0,0,0
Voz De Mando,Estilo Especial,2015,"Adictivo pa' la muerte, mi rifle lo proporciona",2,0,0,0,0,0,0,0,0,0,0
Los Tigres Del Norte,Arnulfo Gonzalez,2003,"Con su pistola en la mano, con la muerte lo amago",3,0,0,0,0,0,0,0,0,0,0
Pesado,Asesino A Sueldo,2008,"Vengo a matar a tu padre, asi dijo el gatillero",2,0,0,0,0,0,0,0,0,0,0
"""El Piporro""",Llego Borracho El Borracho,2002,"Los dos sacaron pistola, se cruzaron los balazos",3,0,0,0,0,0,0,0,0,0,0
Los Tucanes De Tijuana,Gonzalo Inzunza,2014,Y balazos empiezo a tirar,2,0,0,0,0,0,0,0,0,0,0
Antonio Aguilar,Rosita Alvirez,2007,"De tres tiros que le dieron, nomás uno era de muerte",3,0,0,0,0,0,0,0,0,0,0
Antonio Aguilar,Lamberto Quintero,2000,"Dos días despúes de su muerte, vuelven a sonar los tiros",3,0,0,0,0,0,0,0,0,0,0
Los Tigres Del Norte,Carga Blanca,1998,Varios tiros de pistola,2,0,0,0,0,0,0,0,0,0,0
Los Cadetes De Linares,Pista Secreta,2000,"Cayeron dos traficantes, quedando cuatro nomás,",3,2,0,0,0,0,0,0,0,0,0
"""El Piporro""",El Traga Balas,2002,"Pa defender al sufrido, pues la pistola, dispara sola,",2,0,0,0,0,0,0,0,0,0,0
Los Huracanes Del Norte,El Motor 460,1998,"Sonaron cuatro balazos, y la patrulla volaba",2,0,0,0,0,0,0,0,0,0,0
Valentin Elizalde,118 Balazos,2008,60 tiros de cuerno,2,0,0,0,0,0,0,0,0,0,0
Antonio Aguilar,Margarita La De Tijuana,1980,Sonaron cuatro balazos,2,0,0,0,0,0,0,0,0,0,0
Los Cadetes de Linares,Polvo Maldito,1980,Y alcanzo a matar a cuatro,3,0,0,0,0,0,0,0,0,0,0
Millonario,"Calle, Alcohol, Sexo y Placer",2015,Si es hora de matar yo soy el arma mortal,1,0,0,0,0,0,0,0,0,0,0
Los Tigres Del Norte,Los Dos Plebes,2007,La muerte ni los balazos,1,0,0,0,0,0,0,0,0,0,0
Luis Y Julián,Asesino a Sueldo,1983,"Vengo a matar a tú padre, así dijo el gatillero",2,0,0,0,0,0,0,0,0,0,0
Calibre 50,Plebada Alterada,2012,Cuerno y calibre 50,1,0,0,0,0,0,0,0,0,0,0
Los Tigres Del Norte,La Fama De La Pareja,2007,cien kilos de contrabando,0,3,0,0,0,0,0,0,0,0,0
Dharius,La Durango,2018,Era una Suburban gris y otra troca bien paleta,0,1,0,0,0,0,0,0,0,0,0
Los Tucanes De Tijuana,El Tesoro,2008,Trae una troca blindada,0,2,0,0,0,0,0,0,0,0,0
El Komander,Emilio Quintero,2013,"Hisimos el dicomiso, la avioneta se escapo, traiamos barios heridos pero un doctor muy amable nos ayudo en el camino.(y que suene masiso el tololoche pariente desde culiacan sionaloa biejo eaa).",2,2,0,0,0,0,0,0,0,0,0
Los Huracanes Del Norte,"Doble Fondo "" Carga Pesada """,1997,"En la troca habian clavado, varios kilos de heroina",0,3,0,0,0,0,0,0,0,0,0
Los Cadetes De Linares,"Entre Hierba, Polvo Y Plomo",2003,"Entre hierba, polvo y plomo",0,0,0,0,1,0,0,0,0,0,0
Grupo Firme,"Cerveza, Hierva y Polvo",2020,"Con cerveza, hierba y polvo, te la conecta",0,0,0,0,1,0,0,0,0,0,0
Los Tucanes De Tijuana,Sócias De La Mafia,2003,Transportan chiva y coca y de pilón marihuana,0,2,0,0,2,0,0,0,0,0,0
Alemán,Bachas,2020,"Hierba y polvo, eso es de lo que hablo",0,0,0,0,0,0,0,0,0,0,0
Peso Pluma,Put Em In The Fridge,2024,Cuando fumaba mota en blunt con el vecino,0,0,0,0,3,0,0,0,0,0,0
C-Kan,Latinos Unidos,2014,"Mucho, mucho mucho loco, perico coca y foco",0,0,0,0,3,0,0,0,0,0,0
Los Tucanes De Tijuana,El Benefactor De Colima,2008,"Que se pasaba su vida entre hierba polvo y sangre,",1,0,0,0,3,0,0,0,0,0,0
Banda Machos,Traficantes Michoacanos,2000,El polvo y la hierba mala,0,0,0,0,1,0,0,0,0,0,0
Los Tucanes De Tijuana,El Chemo Lopez,2007,"cargado de hierba y polvo a las fronteras llegaba,",0,3,0,0,2,0,0,0,0,0,0
Denilson,Mujeres Y Metales,2021,"Mota, fosfo en este bong",0,0,0,0,1,0,0,0,0,0,0
C-Kan,El Llanto Del Inmigrante,2015,Y Por acá les cruzan marihuana y cocaína,0,3,0,0,2,0,0,0,0,0,0
Calibre 50,El Burro,2012,"Traigo polvo, traigo hierba",0,0,0,0,1,0,0,0,0,0,0
Dharius,Arenosos,2020,"Saca la mota, sácate el bong, saca la lumbre pa' echarme un baizón",0,0,0,0,1,0,0,0,0,0,0
Carlos Y Jose,El Bipper De Mis Amigos,2012,Pa' pedidos de hierba y de coca,0,2,0,0,1,0,0,0,0,0,0
Dharius,Polvo Blanco,2022,"Polvo blanco, hierba verde y pastillas moradas",0,0,0,0,2,0,0,0,0,0,0
Dharius,Mota y Perico,2022,Mota y perico (la neta que estaba especial),0,0,0,0,1,0,0,0,0,0,0
Dharius,Mota y Perico,2022,Mota y perico (y esa carita angelical),0,0,0,0,1,0,0,0,0,0,0
Dharius,Mota y Perico,2022,Mota y perico (tenía un culote sin igual),0,0,0,0,1,0,0,0,0,0,0
Dharius,Mota y Perico,2022,"Mota y perico (la hubieras visto, carnal)",0,0,0,0,1,0,0,0,0,0,0
Dharius,Mota y Perico,2022,Con mota y perico,0,0,0,0,1,0,0,0,0,0,0
Dharius,Mota y Perico,2022,Mota y perico,0,0,0,0,1,0,0,0,0,0,0
Dharius,El Pasado Está Olvidado,2022,"El perico, los waxazos y las bolas de cristal",0,0,0,0,1,0,0,0,0,0,0
Dharius,Polvo Blanco,2022,El cuarto lleno de humo por la mota y por el wax (ah),0,0,0,0,1,0,0,0,0,0,0
Dharius,Polvo Blanco,2022,El cuarto lleno de humo por la mota y por el wax (por el wax),0,0,0,0,1,0,0,0,0,0,0
Vaquero's Musical,Avionetas Cargadas,1997,para bajar los paquetes de polvo y de hierba mala,0,2,0,0,1,0,0,0,0,0,0
Grupo Exterminador,Las Monjitas,1996,Coca pura y también marihuana,0,0,0,0,1,0,0,0,0,0,0
Dharius,Mota y Perico,2022,"Mota y perico (Con whisky, mota y un pascual)",0,0,0,0,1,0,0,0,0,0,0
Dharius,El Loquerón (Parte 1),2022,"Cocaína, marihuana, ya me voy para Tijuana",0,0,0,0,1,0,0,0,0,0,0
Peso Pluma,PRC,2023,"Polvo, ruedas y también cristal",0,1,0,0,1,0,0,0,0,0,0
Grupo Exterminador,Sangre de Valiente,1998,Yo paso con hierba y polvo por toditas las fronteras,0,3,0,0,2,0,0,0,0,0,0
Mexican Institute Of Sound,Mexico,2024,Verde de mota blanco de coca y rojo tu sangre,1,0,0,0,1,0,0,0,0,0,0
Grupo Exterminador,El Cartel De La Calle,1996,Para hacer pacas de billetes,0,0,2,0,0,0,0,0,0,0,0
Carin León,Banqueteras,2025,"Sin decir marcas, son poquitos, pero vale oro su lealtad",0,0,0,0,0,0,0,0,0,0,0
Los Tigres Del Norte,El Canelo,2007,De dólares traiga pacas,0,0,2,0,0,0,0,0,0,0,0
Dharius,Hago Lo Que Quiero,2022,"Las joyas, los lujos y los autos de colección",0,0,2,0,0,0,0,0,0,0,0
Dharius,Ay Güey Ay Güey,2022,"Disco de oro, más conciertos y dinero en mi cartera",0,0,0,0,0,0,0,0,0,0,0
Chalino Sánchez,Armando Aguirre,2012,las mujeres y el dinero,0,0,2,0,0,0,0,0,0,0,0
Dharius,Hago Lo Que Quiero,2022,"Buenos lujos, mujeres y adicción",0,0,2,0,1,0,0,0,0,0,0
Denilson,Lágrimas Y Sangre,2021,No traigo joyas ni diamantes soy el mismo de antes,0,0,0,0,0,0,0,0,0,0,0
Natanael Cano,Porque La Demora,2025,Con pacas de billetes yo me vuelvo loca,0,0,3,0,0,0,0,0,0,0,0
Denilson,Mi Coro,2021,Y diamantes en todo el oro (todo el oro),0,0,3,0,0,0,0,0,0,0,0
Denilson,Mi Coro,2021,"Hoy tengo oro con diamantes, pero no me olvido cuando vendí cobre",0,0,0,0,0,0,0,0,0,0,0
Adan Cruz,Volare,2015,El tiempo es oro vuelvo kilates en dólares mi habilidad garantiza que sonare vida de jet,0,0,3,0,0,0,0,0,0,0,0
El As De La Sierra,El Desconocido,1997,joyas dinero y sus carros,0,0,1,0,0,0,0,0,0,0,0
Voz De Mando,"El Ranchero Al Que Apodan ""el Mayo"" ",2013,Mucho dinero joyas y carros,0,0,1,0,0,0,0,0,0,0,0
Voz De Mando,Gente de Arranque,2013,Brillan el oro y diamantes,0,0,1,0,0,0,0,0,0,0,0
Alemán,Quién Si No,2018,"De dónde viene supé', con joyas y limosí', dinero en el maletín",0,0,2,0,0,0,0,0,0,0,0
Tito Double P,Dos Días,2024,"Me encantan las pacas, me mama el dinero",0,0,3,0,0,0,0,0,0,0,0
Santa Fe Klan,Adiccion,2019,"Nunca nos faltan mujeres, dinero, ni mary jane",0,0,3,0,1,0,0,0,0,0,0
Grupo Exterminador,Me Encanta la Travesura ,2000,El dinero es pa gastarlo no es pa tenerlo guardado si no de que me ha servido lo mucho que he trabajado sirvanle a todos mesera no he venido a pedir fiado con billetes en la bolsa lo que me sobra es la carne el pan me lo dejan fiado lo que me falta es el hambre antes que el mundo se acabe voy a vivir a lo grande,0,0,0,0,0,0,0,0,0,0,0
Chalino Sánchez,El Crimen De Culiacan,1996,Y unos momentos después llegaba la policía,0,0,0,0,0,2,0,0,0,0,0
Mexican Institute Of Sound,Mexico,2024,Con un gobierno involucrado,0,0,0,0,0,3,0,0,0,0,0
Maluma,Hace Un Mes,2024,Ahora me tira por text (uh),0,0,0,0,0,0,0,0,0,0,0
Maluma,Hace Un Mes,2024,Ahora me tira por text,0,0,0,0,0,1,0,0,0,0,0
vagón chicano,Carro Negro,2009,A todos los federales,0,0,0,0,0,0,0,0,0,0,0
Los Tigres Del Norte,A Quien Corresponda,2000,"Vamos despierten señores, encargados del gobierno",0,0,0,0,0,2,0,0,0,0,0
Banda Machos,Pacas De A Kilo,2000,Que tienden los federales,0,0,0,0,0,1,0,0,0,0,0
Chalino Sánchez,El Gallo De Sinaloa ,2008,Lo busca la policía,0,0,0,0,0,1,0,0,0,0,0
Colmillo NORTEÑO,CIEN POR UNO,2008,Esa es la ley de los colombianos,0,0,0,0,0,0,0,0,0,0,0
Valentin Elizalde,Corrido De Juan Martha,2008,y traes la ley en sus manos,0,0,0,0,0,2,0,0,0,0,0
Valentin Elizalde,Juan Luevano Sarmiento,2008,Mientras que unos federales,0,0,0,0,0,1,0,0,0,0,0
Valentin Elizalde,Juan Luevano Sarmiento,2008,Fueron unos federales,0,0,0,0,0,1,0,0,0,0,0
Banda Machos,Fuera De La Ley,2008,De la mafia y de la ley,1,0,0,0,0,1,0,0,0,0,0
Banda Machos,Fuera De La Ley,2008,Ando fuera de la ley,1,0,0,0,0,1,0,0,0,0,0
Chalino Sánchez,Rodolfo Garza,2008,Hombre de muy buena ley,0,0,0,0,0,0,0,0,0,0,0
Valentin Elizalde,Traicion Federal,2008,"Se vino un operativo, de verdes y judiciales",0,0,0,0,0,2,0,0,0,0,0
Valentin Elizalde,Traicion Federal,2008,"A mi rancho ganadero, llegaron los federales",0,0,0,0,0,2,0,0,0,0,0
Valentin Elizalde,El Escape Del Chapo,2008,La policía federal,0,0,0,0,0,1,0,0,0,0,0
Valentin Elizalde,Regresan Los Mafiosos,2008,No se respeta al gobierno,0,0,0,0,0,2,0,0,0,0,0
Grupo Exterminador,Los Dos Rivales,1996,Alto en nombre de la ley!,0,0,0,0,0,1,0,0,0,0,0
Los Tucanes De Tijuana,Armando Soto,1997,Los federales disparan,2,0,0,0,0,3,0,0,0,0,0
Los Tucanes De Tijuana,Armando Soto,1997,Un dia les callo el gobierno,0,0,0,0,0,3,0,0,0,0,0
Millonario & W. Corona,Fumando Weed,2012,"De la chota ron, ron",0,0,0,0,0,1,0,0,0,0,0
Los Tucanes De Tijuana,Jaime González,1997,Con todos los federales,0,0,0,0,0,1,0,0,0,0,0
Los Tucanes De Tijuana,Los Compas De Almoloya,1997,en las manos de la ley,0,0,0,0,0,2,0,0,0,0,0
Millonario & W. Corona,Controlando,2012,Un saludo pa' mis carnales de houston y de ley,0,0,0,0,0,0,0,0,0,0,0
Millonario & W. Corona,Controlando,2012,Por aca en santa me conecto con mis compas de ley,0,0,0,0,0,0,0,0,0,0,0
Millonario & W. Corona,Controlando,2012,"Los helicópteros, marina y federales",0,0,0,0,0,2,0,0,0,0,0
Los Tucanes De Tijuana,Se desgrano la mazorca,1997,ya te apalabre la ley,0,0,0,0,0,0,0,0,0,0,0
El As De La Sierra,La Muerte Del Ligero,1997,nunca peleo con ventaja era hombre de mucha ley,0,0,0,0,0,0,0,0,0,0,0
Chalino Sánchez,Dinastia De Los Ochoa,2025,También a la ley servía,0,0,0,0,0,2,0,0,0,0,0
Chalino Sánchez,Dinastia De Los Ochoa,2025,Unos falsos judiciales,2,0,0,0,0,1,0,0,0,0,0
Illya Kuryaki & The Valderramas,No Way José,1996,Sin darse cuenta alertó a la policía,0,0,0,0,0,1,0,0,0,0,0
Grupo Exterminador,El Baje,1997,De gobierno disfrazado,0,0,0,0,0,2,0,0,0,0,0
Grupo Exterminador,La Fiesta De Los Perrones,1997,El gobierno ya lo sabe,0,0,0,0,0,2,0,0,0,0,0
Banda Sinaloense Los Recoditos,Gordo y Mantecoso,1997,Pero el gobierno me busca,0,0,0,0,0,2,0,0,0,0,0
Banda Sinaloense Los Recoditos,Gordo y Mantecoso,1997,Porque soy hombre de ley,0,0,0,0,0,0,0,0,0,0,0
C-Kan,Ten La Tuya,2012,Cuando no se vean luces de la policía,0,0,0,0,0,1,0,0,0,0,0
Millonario & W. Corona,Mas Flow Mas Cash,2012,"El Mili tira a Lucas, porque el Mili es una fiera",0,0,0,0,0,0,0,0,0,0,0
Los Tucanes De Tijuana,El Promotor De Box,1997,La ley nunca investigó,0,0,0,0,0,2,0,0,0,0,0
Los Tucanes De Tijuana,El Promotor De Box,1997,La policía judicial,0,0,0,0,0,1,0,0,0,0,0
Los Tucanes De Tijuana,Armando Soto,1997,Trabajar Contra el gobierno,0,0,0,0,0,1,0,0,0,0,0
Millonario & W. Corona,Aqui Vou You,2012,La policía mil veces me han arresta'o,0,0,0,0,0,1,0,0,0,0,0
Dharius,Mala Decisión,2022,"No inmortal, pero sí eterno, y chingue a su madre el gobierno",0,0,0,0,0,0,0,0,0,0,0
DJ Agustin,Kuley,2013,"Aquí no cae la ley, hey",0,0,0,0,0,2,0,0,0,0,0
Los Huracanes Del Norte,El Gato de Chihuahua,1996,Caen federales pa'trás,0,0,0,0,0,2,0,0,0,0,0
Los Huracanes Del Norte,El Gato de Chihuahua,1996,"Hermano, cayó la ley",0,0,0,0,0,2,0,0,0,0,0
Grupo Exterminador,Las Monjitas,1996,Y mataron a los federales,0,0,0,0,0,3,0,0,0,0,0
Grupo Exterminador,Los Dos Rivales,1996,"no porque seas del gobierno, me importa un poco tu grado,",0,0,0,0,0,2,0,0,0,0,0
Chino Pacas,ZUMBANDO,2025,"Y como en GTA, voy rompiendo la ley",0,0,0,0,0,3,0,0,0,0,0
Chino Pacas,ZUMBANDO,2025,"Como en GTA, rompiendo la ley",0,0,0,0,0,3,0,0,0,0,0
Chino Pacas,FLOTA,2025,Escucho murmuros aparentes de la chota,0,0,0,0,0,1,0,0,0,0,0
Peso Pluma,Lady Gaga,2023,"Tira jodido, lira jodidón",0,0,0,0,0,0,0,0,0,0,0
Los Invasores De Nuevo Leon,El Güero Palma,1996,"de la ley, y del destino,",0,0,0,0,0,0,0,0,0,0,0
Peso Pluma,VVS,2023,"No le falto el respeto a nadie, saben que soy ley",0,0,0,0,0,0,0,0,0,0,0
Lorenzo De Monteclaro,Ayer Baje De La Sierra,1988,A escondidas del gobierno,0,0,0,0,0,1,0,0,0,0,0
Grupo Exterminador,El Último Viaje,1997,Iba violando la ley,0,0,0,0,0,1,0,0,0,0,0
Lorenzo De Monteclaro,La Banda Del Carro Rojo,1988,Los otros tres del gobierno,0,0,0,0,0,1,0,0,0,0,0
Dharius,Hago Lo Que Quiero,2022,"Las cuentas siguen aumentando, el gobierno me sigue buscando",0,0,0,0,0,2,0,0,0,0,0
Grupo Exterminador,El Muchacho Y El Teniente,1997,A penas tenia 20 años pero agallas le sobraban empezó a tartamudear la r-15 que cargaba y a seis de los federales al mas aya los mandaba,3,0,0,0,0,3,0,0,0,0,0
Grupo Exterminador,El Dedo,1997,Que el gobierno le pagara,0,0,0,0,0,3,0,0,0,0,0
Grupo Exterminador,El Dedo,1997,Con la ley me puso el dedo,0,0,0,0,0,2,0,0,0,0,0
Los Huracanes Del Norte,El Hijo De La Sierra,1997,"Él es mi fiel compañero, por si me encuentro al gobierno",0,0,0,0,0,2,0,0,0,0,0
Los Tigres Del Norte,Carne Quemada,1997,por eso los federales,0,0,0,0,0,1,0,0,0,0,0
Los Tigres Del Norte,Por Debajo Del Agua,1997,en el lado americano.,0,0,0,0,0,1,0,0,0,0,0
Los Tigres Del Norte,Jefe De Jefes,1997,Muchos creen que me busca el gobierno,0,0,0,0,0,1,0,0,0,0,0
Jenni Rivera,Las Cachanillas,2012,Pa no topar federales por aire andan ahora,0,2,0,0,0,1,0,0,0,0,0
Jenni Rivera,La Maestra Del Contrabando,2012,Yo se que me andan buscando la DEA y la Chota,0,0,0,0,0,1,0,0,0,0,0
Vaquero's Musical,Avionetas Cargadas,1997,De la ley no se preocupen esta muy bien dominada,0,0,0,0,0,3,0,0,0,0,0
Grupo Exterminador,El Último Viaje,1997,Toreaban los de la ley,0,0,0,0,0,1,0,0,0,0,0
C-Kan,Cuando Era Niño,2012,"Las riñas, los puercos y el narcomeludeo",0,2,0,0,0,2,0,0,0,0,0
C-Kan,Esta Vida Me Encanta,2012,"ni presidente ni juez mucho menos policía,",0,0,0,0,0,1,0,0,0,0,0
Grupo Exterminador,El Último Viaje,1997,Los agentes de la ley,0,0,0,0,0,1,0,0,0,0,0
Los Huracanes Del Norte,Ranchos Famosos,1997,"Y hasta el gobierno la piensa, pa' visitarlos",0,0,0,0,0,3,0,0,0,0,0
Los Huracanes Del Norte,Informe Del Dea,1997,Un grupo de federales se dio cita en el lugar,0,0,0,0,0,1,0,0,0,0,0
Los Huracanes Del Norte,Los Tres Sinaloenses,1997,Judiciales del estado estaban bien,0,0,0,0,0,1,0,0,0,0,0
Chalino Sánchez,Ignacio Parra,2012,el gobierno me buscaba,0,0,0,0,0,1,0,0,0,0,0
Los Huracanes Del Norte,Los Tres Sinaloenses,1997,Movilizados federales y soldados,0,0,0,0,0,1,0,0,0,0,0
Los Huracanes Del Norte,La Suburban Dorada,1997,Cayeron seis judiciales,0,0,0,0,0,2,0,0,0,0,0
Los Tucanes De Tijuana,Consulado privado,1997,También es contra la ley,0,0,0,0,0,1,0,0,0,0,0
Jenni Rivera,Jefa De Jefas,2012,La adea y la chota,0,0,0,0,0,1,0,0,0,0,0
Chayito Valdez,Simon Blanco,1985,"Que el gobierno respetaba,",0,0,0,0,0,3,0,0,0,0,0
Los Cadetes De Linares,Nave 727,2008,Ninguna ley de la tierra,0,0,0,0,0,0,0,0,0,0,0
Voz De Mando,"El Ranchero Al Que Apodan ""el Mayo"" ",2013,Gobierno mexico americano,0,0,0,0,0,2,0,0,0,0,0
Los Tigres Del Norte,El Hijo Menor,1996,Que no ha quedado imprimida porque es la ley del destino,0,0,0,0,0,0,0,0,0,0,0
Los Tigres Del Norte,El Reportero,1996,"Buscando contrabandistas, me hallaron los federales,",0,1,0,0,0,2,0,0,0,0,0
Natanael Cano,Porque La Demora,2025,Con la ley de la atracción al todo mal logrado,0,0,0,0,0,0,0,0,0,0,0
Natanael Cano,Como Es,2025,"Si el gobierno me busca, bebé",0,0,0,0,0,2,0,0,0,0,0
"Natanael Cano, Anuel AA",Como Es (Remix),2025,"Si el gobierno me busca, bebé, yo me monto en el jet y me pelo",0,0,0,0,0,2,0,0,0,0,0
Mariel Mariel,La Mercancía,2013,Que se lo lleva el viento o el policía,0,0,0,0,0,1,0,0,0,0,0
Blnko,Irreverente/Desaparezco,2023,Me tira mucho pendejo pero ninguno me nombra,0,0,0,0,0,0,0,0,0,0,0
Los Invasores De Nuevo Leon,El Baron Del Golfo,1996,El gobierno Americano pa juzgar a juan Garcia por ser,0,0,0,0,0,1,0,0,0,0,0
Los Invasores De Nuevo Leon,El Baron Del Golfo,1996,el gobierno Americano sabe que es de sangre azteca y,0,0,0,0,0,1,0,0,0,0,0
Los Invasores De Nuevo León,El Último Cartucho,1996,El gobierno lo buscaba,0,0,0,0,0,2,0,0,0,0,0
Los Invasores De Nuevo León,El Último Cartucho,1996,Sin que la ley lo supiera,0,0,0,0,0,1,0,0,0,0,0
Los Tucanes De Tijuana,El Chapo Guzmán,1996,La ley nunca lo encontró,0,0,0,0,0,0,0,0,0,0,0
Los Huracanes Del Norte,El Corrido De Juan Martha,1988,Del gobierno los rurales le temian,0,0,0,0,0,1,0,0,0,0,0
Antonio Aguilar,Jacinto Treviño,1988,"Decía el sheriff mayor, como era un americano",0,0,0,0,0,1,0,0,0,0,0
Los Huracanes Del Norte,El Parrandero,1997,"Peleaba de frente, con los federales",2,0,0,0,0,2,0,0,0,0,0
Calibre 50,De Sinaloa Para El Mundo,2012,"Me busca el gobierno, quieren agarrarme",0,0,0,0,0,2,0,0,0,0,0
Los Caminantes,Benito Canales,1984,Gritando los federales,0,0,0,0,0,1,0,0,0,0,0
Los Caminantes,La Mafia Muere,1984,Otros grandes también del gobierno,0,0,0,0,0,1,0,0,0,0,0
Antonio Aguilar,Pánfilo Natera,1984,Les dijo a los federales...,0,0,0,0,0,1,0,0,0,0,0
Los Cadetes De Linares,Los Contrabandistas,1976,Bandidos contra la ley,0,0,0,0,0,1,0,0,0,0,0
Chalino Sánchez,Juan Cantu,2012,Los agentes del gobierno,0,0,0,0,0,1,0,0,0,0,0
Calibre 50,El Burro,2012,Capoteandome al gobierno,0,0,0,0,0,1,0,0,0,0,0
Los Tucanes De Tijuana,El Jabalí,1997,la ley me esta protejiendo mas vale,0,0,0,0,0,3,0,0,0,0,0
Los Tucanes De Tijuana,El Jabalí,1997,los que a la ley le entregaron,0,0,0,0,0,2,0,0,0,0,0
"Peso Pluma, Luis R Conriquez",Siempre Pendientes,2022,Porque el gobierno es muy inteligente,0,0,0,0,0,2,0,0,0,0,0
Los Huracanes Del Norte,El Leon De La Sierra,1988,"Murieron los federales, en las manos de una fiera,",3,0,0,0,0,3,0,0,0,0,0
Los Huracanes Del Norte,La Fiera,1988,"Tres policías judiciales, que tanto lo atormentaron",1,0,0,0,0,3,0,0,0,0,0
Los Huracanes Del Norte,Ranchos Famosos,1997,"Pero a la mala, no respetan federales",0,0,0,0,0,2,0,0,0,0,0
Chalino Sánchez,El Dos Dedos,2012,Cuando vio a los federales,0,0,0,0,0,1,0,0,0,0,0
Chalino Sánchez,Nacho Verduzco,2012,Un policía se llevó,0,0,0,0,0,1,0,0,0,0,0
Los Cadetes De Linares,El Tartanero,1984,"""Este hombre es de mucha ley",0,0,0,0,0,0,0,0,0,0,0
Los Caminantes,Valentin De La Sierra,1984,En manos del gobierno,0,0,0,0,0,2,0,0,0,0,0
Los Caminantes,Benito Canales,1984,Viva el supremo gobierno,0,0,0,0,0,1,0,0,0,0,0
Calibre 50,Plebada Alterada,2012,Para la ley son el rey,0,0,0,0,0,1,0,0,0,0,0
Calibre 50,Plebada Alterada,2012,Si nos molesta la ley,0,0,0,0,0,1,0,0,0,0,0
Calibre 50,Renovar O Morir,2012,Esa es la ley de la vida,0,0,0,0,0,0,0,0,0,0,0
Los Huracanes Del Norte,Clave 7,1988,"Ninguna ley del gobierno, mi nombre podrá cambiar",0,0,0,0,0,3,0,0,0,0,0
Los Huracanes Del Norte,Clave 7,1988,"En el reten de la loma, estaban 100 federales,",0,1,0,0,0,1,0,0,0,0,0
C-Kan,El Llanto Del Inmigrante,2015,Pa esos a los que el gobierno considera,0,0,0,0,0,1,0,0,0,0,0
C-Kan,El Llanto Del Inmigrante,2015,De que la calle y el gobierno sea un desorden,0,0,0,0,0,1,0,0,0,0,0
C-Kan,El Llanto Del Inmigrante,2015,el enemigo es el gobierno Americano,0,0,0,0,0,1,0,0,0,0,0
Chalino Sánchez,La Muerte Del Pela Vacas,2012,Perseguido por la ley,0,0,0,0,0,2,0,0,0,0,0
C-Kan,Mama Me Dijo Un Dia,2015,"No hay más reventones, balas ni problemas con la ley",2,0,0,0,0,1,0,0,0,0,0
C-Kan,Mama Me Dijo Un Dia,2015,Si lo fueron a casar o ya se lo cargo la tira,3,0,0,0,0,2,0,0,0,0,0
C-Kan,Mama Me Dijo Un Dia,2015,"Ellos quien llaman a la policía, no",0,0,0,0,0,1,0,0,0,0,0
Chalino Sánchez,Nacho Verduzco,2012,La ley no se imaginaba,0,0,0,0,0,1,0,0,0,0,0
Chalino Sánchez,Chico El Colorado,2012,"Tenia muchos enemigos siempre andaba bien armado, mucho miedo le tenian judiciales y soldados",1,0,0,0,0,2,0,0,0,0,0
Blnko,Siempre la Cago,2021,"Morra, tira paro y vuelve",0,0,0,0,0,0,0,0,0,0,0
